ts_code,name,concept,business,q_np_change
000007.SZ,*ST全新,"纾困概念,口罩,深圳特区,一般物业经营","投资兴办实业(具体项目另行申报);国内商业、物资供销业(不含专营、专控、专卖商品);自有物业租赁;环保产品的技术开发;信息咨询(不含限制项目);项目投资(不含限制项目);矿业投资;矿产品的销售(不含专营、专控、专卖商品);经营进出口业务。2016年2月3日公司经营范围变更为:投资兴办实业(具体项目另行申报);国内商业、物资供销业(不含专营、专控、专卖商品);自有物业租赁;环保产品的技术开发;信息咨询(不含限制项目);项目投资;矿业投资;矿产品的销售(不含专营、专控、专卖商品),经营进出口业务(法律、行政法规、国务院决定禁止的项目除外,限制的项目须取得许可后方可经营);投资金融服务项目并进行投资管理(不得从事证券投资活动;不得以公开方式募集资金开展投资活动;不得从事公开募集基金管理业务);从事其他投资与投资管理",147.50%
000150.SZ,宜华健康,"健康中国,医疗器械,医疗美容,医疗服务,互联医疗,养老概念",医疗产业服务和养老产业服务等,3.60%
000516.SZ,国际医学,"基因测序,辅助生殖,医疗美容,医疗服务,互联医疗,免疫治疗,阿里概念,无人机",医疗服务和百货零售业,33.70%
000564.SZ,*ST大集,"创投,抖音小店,新零售,一带一路,冷链物流,电商概念,免税概念,社区团购,网红直播,百货",商业零售(百货、超市),24.40%
000638.SZ,万方发展,"病毒防治,增强现实,大数据,军工,生物疫苗,其他软件服务,互联医疗,京津冀,北京冬奥,智能穿戴","以土地一级整理和城镇基础建设投资为主,辅以贸易等综合业务",48.90%
000650.SZ,仁和药业,"独家药品,病毒防治,中药生产,工业大麻,生物疫苗,互联医疗,消毒剂,中药",生产、销售中西药、原料药及健康相关产品,41.80%
000655.SZ,金岭矿业,"铁矿石,小金属,稀缺资源","铁矿石开采,铁精粉、铜精粉、钴精粉、球团矿的生产、销售及机械加工与销售。",225.40%
000673.SZ,*ST当代,"区块链,大数据,影视概念,影视",以电视剧、电影、综艺节目、影院业务、衍生业务为主的影视文化全产业链的业务体系。,-44.60%
000679.SZ,大连友谊,"免税概念,东北振兴,百货,新零售",商业零售、酒店服务和房地产开发与销售。,83.30%
000697.SZ,炼石航空,"小金属,航空装备,军工,无人机",制造加工各种航空器相关精密零部件、结构件等,-84.40%
000707.SZ,ST双环,"煤化工,纯碱","化工业务,房地产业务,贸易业务",68.40%
000722.SZ,湖南发展,"页岩气,养老概念,水利建设,水电",水力发电综合开发经营业务。,-35.60%
000813.SZ,德展健康,"健康中国,工业大麻,医疗美容,生物疫苗,生物医药,化妆品概念",药品的研发、生产和销售,-16.30%
000820.SZ,*ST节能,"节能环保,环保",钢铁、有色行业节能环保工程咨询、设计、设备供货和EPC总承包业务,65.30%
000835.SZ,*ST长动,"成渝特区,游戏娱乐,网络游戏","致力于通过多元化、多渠道的发展,实现公司以IP为导向的动漫形象和动漫游戏作品的收益最大化。",-215.40%
000893.SZ,亚钾国际,"生态农业,钾肥",钾肥经营,323.10%
000906.SZ,浙商中拓,"阿里概念,贸易,电商概念,股权激励",生产、销售建筑材料(不含硅酮胶)。,203.40%
000948.SZ,南天信息,"区块链,数字货币,智慧城市,创投,互联金融,物联网,碳交易,ETC,大数据,其他软件服务,在线教育,华为概念,云计算,UWB概念,移动支付,国产软件",软件开发、系统集成、金融专用设备研究开发与生产经营。,50.20%
000950.SZ,重药控股,"医药商业,医疗器械,病毒防治,基因测序,辅助生殖,医疗美容,冷链物流,互联医疗,养老概念,快递概念,成渝特区,疫苗冷链,中药",药品、医疗器械的批发和零售业务。,-26.50%
000966.SZ,长源电力,"火电,创投,太阳能,风能,碳交易",电力、热力生产和销售,268.80%
000972.SZ,*ST中基,"医疗器械,健康中国,农产品加工",工业(番茄制品的加工、销售)、国际(国内)贸易及房地产开发等业务。,-53.20%
000980.SZ,*ST众泰,"无人驾驶,氢能源,乘用车,新能源车",汽车整车生产制造。,39.30%
000981.SZ,*ST银亿,"汽车零部件,新能源车",从事房地产业和高端制造业,47.30%
000995.SZ,皇台酒业,"壳资源,白酒","白酒、葡萄酒的生产、批发零售,自产酒类副产品的批发零售",20.30%
001203.SZ,大中矿业,"基本金属,铁矿石",铁矿石采选、铁精粉和球团的生产销售以及机制砂石的加工销售。,561.70%
002015.SZ,协鑫能科,"新能源发电,数据中心,长江三角,天然气,节能环保,风能,新能源,碳交易",清洁能源发电、热电联产及综合能源服务,256.10%
002072.SZ,*ST凯瑞,其他互联网服务,煤炭贸易业务及房屋租赁业务,-161.60%
002133.SZ,广宇集团,"养老概念,房地产开发,长江三角","房地产开发与销售,同时公司经营与房地产相关的物业管理、物业出租、材料销售等业务",33.00%
002147.SZ,*ST新光,"长江三角,房地产开发,智能机器,风能",房地产开发和商业经营,75.60%
002154.SZ,报喜鸟,"创投,电商概念,服装,长江三角,网红直播",西服、衬衫等男士系列服饰的生产和销售。,199.50%
002175.SZ,*ST东网,"智能电视,虚拟现实,影视概念,超清视频,仪器仪表",从事数显量具量仪及相关产品的生产、销售与研发。,47.80%
002188.SZ,*ST巴士,"长江三角,电子元件,网红直播","通讯电声器材的生产,电声器材、电声元器件、电声组合件以及相关的工装、设备的研发、销售,经营进出口业务,智能硬件、智能终端设备及其组件的研发、销售,计算机软件、智能硬件和智能终端设备的应用软件的开发、技术服务、技术转让,设计、制作、代理、发布国内各类广告。投资管理,会展服务。",-21.50%
002195.SZ,二三四五,"区块链,网络安全,字节概念,创投,互联金融,长江三角,人工智能,其他互联网服务,国产软件",互联网信息服务,12.40%
002219.SZ,*ST恒康,"独家药品,医疗服务,中药",医疗服务、药品制造、日化品及保健品,21.30%
002230.SZ,科大讯飞,"独角兽,无线耳机,智能家居,雄安新区,量子通信,数字孪生,互联医疗,车联网,智能穿戴,智慧城市,人脑工程,阿里概念,商汤概念,华为概念,行业应用软件,生物识别,无人驾驶,在线教育,超清视频,远程办公,人工智能,国产软件",语音支撑软件、行业应用产品/系统、信息工程和运维服务等。,178.70%
002256.SZ,*ST兆新,"充电桩,降解塑料,深圳特区,太阳能,新能源,涂料涂漆,锂电池",新能源、精细化工、生物降解材料三大类业务,-4.70%
002316.SZ,亚联发展,"区块链,特高压,电子车牌,物联网,智慧政务,ETC,大数据,数据中心,新零售,壳资源,智能电网,深圳特区,华为概念,移动支付,云计算,通信配套服务,5G概念,工业互联","公司智慧经营领域主要从事第三方支付业务及金融科技业务,公司智慧专网领域主要为能源、交通等行业提供信息通信技术解决方案。",45.70%
002336.SZ,ST人乐,"电商概念,新零售,超市,深圳特区,地摊经济",从事大卖场、综合超市及百货的连锁经营业务。,-1193.20%
002356.SZ,*ST赫美,"创投,互联金融,纾困概念,珠宝首饰,电商概念,超级电容,深圳特区,智能电网,移动支付,电子竞技",珠宝产业链、高端智能制造,19.10%
002383.SZ,合众思壮,"国产芯片,智慧城市,物联网,无人驾驶,大数据,北斗导航,军工,卫星应用,水利建设,华为概念,UWB概念,车联网",从事卫星导航定位产品的研发、生产、销售和服务。,39.40%
002426.SZ,胜利精密,"半导体,特斯拉,纾困概念,苹果概念,华为概念,5G概念,消费电子设备,小米概念,智能穿戴",精密结构模组的研发、设计、生产和后续改进等全流程服务,112.40%
002473.SZ,*ST圣莱,小家电,从事水加热生活电器核心零部件及整机的研发、生产和销售。,33.40%
002490.SZ,山东墨龙,"矿山冶金机械,海工装备,页岩气,天然气,油气设服","从事能源装备行业所需产品的研发、生产与销售,主要产品包括油气开采用管、流体及结构用管、抽油机、抽油泵、抽油杆、钻机用缸套、阀门散件及大型铸锻件等。",-48.80%
002513.SZ,*ST蓝丰,"蝗虫防治,阿兹海默,生态农业,农药",1农化业务:杀菌剂原药及制剂杀虫剂原药及制剂除草剂原药及制剂精细化工中间体的生产和销售。2医药业务:原料药片剂胶囊剂日用化妆品卫生用品类的生产销售自产产品。,101.80%
002577.SZ,雷柏科技,"无线耳机,百度概念,深圳特区,智能机器,无线充电,电子竞技,无人机,PC、服务器及硬件",从事鼠标、键盘等电脑外设设备的研发、生产和销售业务。,120.50%
002592.SZ,ST八菱,"免疫治疗,工业大麻,燃料电池,汽车零部件",汽车零部件制造及文化演艺业务,214.60%
002607.SZ,中公教育,"独角兽,在线教育,超级品牌,成人教育",非学历职业就业培训服务,18.70%
002619.SZ,*ST艾格,"手游概念,创投,综合互联网服务,云计算,网络游戏",互联网信息服务、软件服务及文化产业,-137.20%
002646.SZ,青青稞酒,白酒,"青稞酒的研发、生产、销售,主要产品含互助、天佑德、八大作坊、永庆和等系列。",2417.60%
002668.SZ,奥马电器,"纾困概念,区块链,互联金融,白色家电",从事冰箱制造和销售业务、金融科技。,-434.60%
002684.SZ,*ST猛狮,"创投,军工,新能源车,氢能源,智能电网,燃料电池,锂电池,汽车零部件",各类铅蓄电池产品的研发、生产和销售。,-32.30%
002776.SZ,ST柏龙,"医疗器械,口罩,服装,网红直播","专注于服装设计,同时根据客户要求对公司设计款式提供配套组
织生产服务.",-134.30%
300064.SZ,*ST金刚,"非金属新材料,新材料,超级电容,创业板综","人造金刚石及其原辅材料的研发、生产和销售,以及人造金刚石合成设备的研究开发。",-4.80%
300272.SZ,开能健康,"基因测序,医疗美容,创业板综,免疫治疗,环保设备,节能环保",全屋净水机、全屋软水机、商用净化饮水机、RO膜反渗透净水机、多路控制阀、复合材料压力容器等人居水处理产品的研发、制造、销售与服务。,1215.10%
300530.SZ,*ST达志,"充电桩,新能源车,创业板综,其他化学制品,锂电池",新型环保表面工程化学品的研发、生产及销售,-494.00%
300672.SZ,国科微,"国产芯片,半导体,物联网,北斗导航,集成电路,创业板综,超清视频",大规模集成电路的设计、研发及销售,97.80%
300937.SZ,药易购,"医药商业,大数据,创业板综,互联医疗,快递概念,次新股",面向院外市场的医药类产品批发及零售,-126.50%
600007.SH,中国国贸,"房地产开发,中字头","商务服务设施的投资、经营和管理,包括高档甲级写字楼、商城、公寓等设施的出租及管理,高档酒店经营,大型展览及配套服务及停车设施服务等",16.50%
600058.SH,五矿发展,"小金属,电商概念,贸易,新材料",主要从事冶金原材料供应业务、钢铁流通及制品业务、物流业务、招标业务和电子商务平台运营。,265.60%
600083.SH,*ST博信,"人工智能,专业工程,无线耳机",智能硬件、人工智能、市政工程业务,55.40%
600090.SH,*ST济堂,"医药商业,医疗器械",医药流通行业,-143.50%
600091.SH,*ST明科,氯碱,"烧碱、聚氯乙烯树脂、硫酸、盐酸、苯酚、氢氟酸、无水氟化氢、氟化盐产品、液氯、电石、溶解乙炔、高压聚乙烯,高科技生物产品的开发与生产,电子产品的生产和销售,计算机的生产、研制开发,计算机软硬件及外围设备的生产销售,计算机设备的销售、仓储、租赁及其它经营业务,信息产业、网络工程及远程教育服务,环保设备生产及销售。",-6.70%
600122.SH,*ST宏图,"连锁,互联金融,新零售,长江三角,移动支付,智能穿戴",电子计算机网络工程设计、施工、安装;电子计算机及配件、通信设备(不含卫星地面接收设施)开发、研制、生产、销售及售后服务与咨询;摄影器材、金属材料、建筑装饰材料、五金交电(不含助力车)、水暖器材、陶瓷制品、电器机械、汽配、百货、针纺织品、电子辞典(非出版物)、计算器、文教办公用品销售;家电维修;实业投资;投资管理;房地产开发经营;自营和代理各类商品和技术的进出口(但国家限定公司经营和禁止进出口的商品和技术除外)。,22.30%
600136.SH,当代文体,"影视概念,体育产业,影视",影视产品制作销售及发行、艺人经纪、节目制作、影院投资及管理、娱乐营销、体育营销、体育版权贸易、体育经纪、体育场馆运营、体育培训、赛事运营,-86.80%
600146.SH,*ST环球,"区块链,互联金融,电商概念,体育产业,服装,互联医疗","布料贸易,成衣销售",29.10%
600155.SH,华创阳安,"互联金融,券商概念,京津冀,证券,新材料",证券业务和塑料管型材业务,-21.90%
600172.SH,黄河旋风,"军工,智能家居,智能机器,非金属新材料,新材料","人造金刚石,人造金刚石磨料磨具磨削及其它金刚石制品,建筑装修磨削机具;与上述经营范围相关的技术服务,经营本企业自产产品及相关技术的进出口业务;经营本企业生产、科研所需的原辅材料、仪器仪表、机械设备、零配件及相关技术的进出口业务(国家限定公司经营和国家禁止进出口的商品及技术除外);经营来料加工和“三来一补”业务。",117.20%
600191.SH,*ST华资,"乳业,农产品加工",制糖、仓储,48.50%
600199.SH,金种子酒,"白酒,地塞米松",主要从事白酒生产。普通货运(按许可证有效期限经营);包装材料加工、制造与销售;生产白酒所需原辅材料收购;自营和代理各种商品和技术进出口业务。,-67.60%
600215.SH,长春经开,"土地流转,东北振兴,园区开发,特斯拉",公用设施投资、开发、建设、租赁、经营、管理;房地产开发与物业管理;实业与科技投资。,83.60%
600234.SH,山水文化,"网络游戏,壳资源,房地产服务",自有房屋租赁业务、高端红酒贸易业务和广告传媒业务。,117.60%
600239.SH,*ST云城,"养老概念,房地产开发",房地产开发与经营、商品房销售、房屋租赁;基础设施建设投资、土地开发。,-23.00%
600243.SH,青海华鼎,"铁路基建,机床设备",主要从事数控机床产品、食品机械、电梯配件、照明设备等的研发、生产及销售,60.50%
600250.SH,南纺股份,"长江三角,贸易,创投",纺织品进出口、代理进出口业务。,-171.90%
600257.SH,大湖股份,"互联金融,电商概念,白酒,养老概念,淡水渔业,水产养殖,节能环保",水产品养殖及销售、投资中成药生产销售和医药贸易以及白酒类产品的销售和家用电器的批发业务等。,170.70%
600265.SH,*ST景谷,"壳资源,木材加工,稀缺资源",林化产品加工和人造板制造、森林资源培育、木材采运、加工、林业技术研发以及能源贸易。,40.70%
600284.SH,浦东建设,"路桥建设,创投,长江三角,上海自贸,节能环保",从事道路、桥梁、各类基础设施施工以及建材的研制开发和生产。,53.40%
600307.SH,酒钢宏兴,"核能核电,一带一路,普钢,低碳冶金","公司是一家集采矿、选矿、烧结、焦化、炼铁、炼钢、热轧、冷轧以及不锈钢生产为一体,具备年产1000万吨以上钢材生产能力的综合型钢铁企业,目前形成了以嘉峪关本部和兰州榆钢两大生产基地,产品涵盖碳钢和不锈钢。碳钢产品覆盖线、棒、板、带四大系列,主要产品有高速线材、棒材、中厚板材、热轧卷板、冷轧卷板、各类涂镀材卷板(镀锌、镀铝锌、锌铝镁)等。不锈钢产品主要形成了铁素体、奥氏体、马氏体和双相不锈钢等四大系列产品;同时,借助不锈钢生产体系的完整性和装备先进性,公司开创了国内第一个钛产品成卷的先河,已具备从板坯至热轧黑卷产品、热轧酸洗白卷、冷轧退火板带、冷轧退火酸洗板带全流程钛板加工能力。",272.20%
600408.SH,ST安泰,"煤化工,焦炭","生产、销售焦炭及副产品、化肥(硫铵)、相关化工产品(国家限定的除外)、生铁、钢材、水泥、水泥制品、电力、碳素制品;煤炭洗选;石灰石开采、加工;货物运输;新产品开发;批发零售矿产品(除国家专控品)、化工原料(除易燃易爆易腐蚀危险品)、普通机械、汽车(除小轿车)、日杂百货、农副产品(除国家专控品);自营和代理各类商品及技术的进出口业务,但国家限定经营或禁止的商品及技术除外;实业投资。",4452.10%
600518.SH,*ST康美,"健康中国,医疗器械,中药生产,电商概念,流感,互联医疗,养老概念,中药",中药饮片、药品医疗器械等医药产品的生产、经营、批发销售以及中药材贸易业务等。,-87.60%
600526.SH,菲达环保,"长江三角,环保设备,节能环保,碳交易",大气污染治理,116.00%
600559.SH,老白干酒,白酒,"衡水老白干酒的生产与销售,商品猪及种猪的饲养与销售。",-20.60%
600587.SH,新华医疗,"健康中国,医疗器械,互联医疗,消毒剂,医废处理",许可证规定范围内的消毒灭菌设备、放射诊断治疗设备、医用化学指示产品与制药设备、环保设备的生产、销售、技术服务。,440.20%
600608.SH,ST沪科,"长江三角,特钢",通信网络设备、计算机信息工程、集成电路设计与销售、智能社区网络、异型钢管及酒店服务等。,-202.10%
600615.SH,*ST丰华,"长江三角,金属制品",生产镁合金、铝合金制品,-45.90%
600645.SH,中源协和,"独角兽,体外诊断,基因测序,精准医疗,生物医药,长江三角,免疫治疗,单抗概念,人工智能",干细胞、免疫细胞、基因检测、体外诊断等相关领域技术服务,1329.50%
600666.SH,ST瑞德,"蓝宝石,其他专用机械,3D玻璃",蓝宝石晶体材料及蓝宝石制品的研发、生产和销售;硬脆材料精密加工专用设备的研发、设计、生产和销售;3D玻璃热弯机研发、生产和销售,-95.30%
600702.SH,ST舍得,"成渝特区,白酒","酒类产品、玻瓶产品,中国名酒“沱牌曲酒”及其系列产品",788.40%
600715.SH,文投控股,"手游概念,影视,影视概念,东北振兴,网络游戏,北京冬奥","影城运营管理、影视投资制作及发行、游戏研发与运营、“文化+”业务,涉及文化娱乐相关产业",101.80%
600716.SH,凤凰股份,"养老概念,房地产开发",房地产开发、商品房销售,952.60%
600721.SH,*ST百花,"CRO,医疗服务","药物发现、研究、技术服务,提供从药物发现、CMC、临床CRO、药品注册、CMO/API供应等新药开发全流程的服务及一体化的解决方案。",376.90%
600735.SH,新华锦,"医疗器械,其他轻工,RCEP概念,二胎概念,医疗美容,养老概念,石墨烯",发制品和纺织服装产品的研发、生产和出口销售,-2.30%
600744.SH,华银电力,"火电,创投,核能核电,风能,新能源,碳交易",电力生产及销售。,-189.50%
600760.SH,中航沈飞,"军民融合,军工,国家安防,航空装备,无人机",航空产品制造,9.30%
600767.SH,ST运盛,"健康中国,医疗服务,互联医疗,长江三角","城市基础设施开发及配套服务,城市供水、能源、交通、工业、房地产项目开发、工程承包。",80.90%
600827.SH,百联股份,"退税商店,新零售,电商概念,长江三角,阿里概念,免税概念,百货",综合百货、连锁超市、装潢装饰材料、仓储运输、进出口业务、餐饮服务、食品生产、娱乐、实业投资、房地产开发经营、房屋中介、房屋出租、物业管理、服装针纺织品、五金交电、文教用品、烟酒茶食品、中西成药、音像制品、新旧工艺品、金银制品、家具、古玩收购(涉及许可经营的凭许可证经营)。,295.40%
600848.SH,上海临港,"独角兽,创投,沪企改革,核能核电,长江三角,房地产开发,商汤概念,租售同权,上海自贸",产业园区的开发建设、运营管理、综合服务。,81.80%
600872.SH,中炬高新,调味品,"调味食品,园区综合开发管理等",-16.50%
600895.SH,张江高科,"独角兽,创投,半导体,沪企改革,新能源车,阿里概念,房地产开发,租售同权,光刻胶,上海自贸,蚂蚁概念","受让地块内的土地开发与土地使用权经营,商业化高科技项目投资与经营等。",85.20%
600906.SH,财达证券,"券商概念,证券,次新股",证券经纪、证券投资咨询、证券承销与保荐、证券自营、证券资产管理、融资融券、证券投资基金代销、与证券交易、证券投资活动有关的财务顾问、代销金融产品、为期货公司提供中间介绍业务,5.60%
601279.SH,英利汽车,"次新股,汽车零部件,新能源车",车身结构零部件及防撞系统零部件的设计、研发、制造及销售,155.20%
601567.SH,三星医疗,"医疗器械,充电桩,物联网,医疗美容,智能家居,互联医疗,2025规划,智能电网,电气仪表",电能计量及信息采集产品、配电设备的研发、生产和销售。,12.10%
601969.SH,海南矿业,"电商概念,天然气,铁矿石",铁矿石采选和销售。,128.60%
603020.SH,爱普股份,"调味品,人造肉",香料、香精和食品配料的研发、制造和销售。,72.40%
603098.SH,森特股份,"装修装饰,雄安新区,光伏建筑一体化","公司主营业务为研发、生产、销售绿色、环保、节能新型建材并提供相关工程设计、生产、安装和售后等一体化服务,主要承接金属围护系统工程(屋面系统、墙面系统)和声屏障系统工程,提供从工程咨询、设计、专用材料供应和加工制作到安装施工全过程的工程承包服务。",2.50%
603157.SH,*ST拉夏,"电商概念,服装,创投","主要於中国从事设计、推广及销售服饰产品业务,专注於大众女性休闲服装。该公司致力於通过九个现有品牌向顾客提供时尚服装,包括La Chapelle、Puella、UlifeStyle、7.Modifier、Candie’s、La Babité、Vogeek、Pote和La Chapelle Kids。",79.70%
603609.SH,禾丰股份,"猪肉概念,饲料,鸡肉概念,水产养殖",饲料生产、肉禽产业化、饲料原料贸易及相关业务。,-1.50%
603615.SH,茶花股份,"垃圾分类,电商概念,二胎概念,塑料制品",以日用塑料制品为主的家居用品的研发、生产和销售。,34.50%
603696.SH,安记食品,调味品,调味品的研发、生产和销售,47.10%
603697.SH,有友食品,"成渝特区,食品综合",泡卤风味休闲食品的研发、生产和销售,37.20%
603798.SH,康普顿,石油加工,"为车辆、工业设备提供润滑和养护的系列产品,主要包括车用润滑油、工业润滑油、汽车化学品及汽车养护品的研发、生产与销售。",62.20%
603919.SH,金徽酒,白酒,白酒生产及销售,95.30%
603933.SH,睿能科技,"其他电子器件,ETC,半导体",以针织横机电脑控制系统的研发、生产和销售为主的制造业务及以IC产品分销为主的分销业务,631.80%
605016.SH,百龙创园,"代糖概念,食品综合,次新股",主营业务为益生元系列产品、膳食纤维系列产品和其他淀粉糖(醇)系列产品的研发、生产及销售,22.50%
605055.SH,迎丰股份,"次新股,其他纺织","公司专业从事纺织品的印染加工业务,致力于为客户提供专业化、一体化、个性化的印染综合服务",272.50%
605089.SH,味知香,"食品综合,次新股","半成品菜的研发,生产和销售",无
605117.SH,德业股份,"国产芯片,其他家电,次新股,太阳能",主要从事蒸发器、冷凝器和变频控制芯片等部件以及除湿机和空气源热泵热风机等环境电器产品的研发、生产和销售,122.70%
605198.SH,德利股份,"节能环保,次新股,软饮料",浓缩果汁的加工生产及销售,-15.70%
605300.SH,佳禾食品,"食品综合,次新股",植脂末、咖啡及其他固体饮料等产品的研发、生产和销售,46.40%
605337.SH,李子园,"乳业,电商概念,二胎概念,次新股,软饮料",甜牛奶乳饮料系列等含乳饮料和其他饮料的研发、生产与销售,335.20%
605388.SH,均瑶健康,"乳制品,乳业,次新股,二胎概念","公司秉持“弘扬健康饮食,引领良品升级”的发展理念,坚持推广品质优良的系列健康饮品,目前主营常温乳酸菌系列饮品的研发、生产和销售,并陆续推出其他系列健康饮品。",33.30%
